{
  "schema_version": 1,
  "patient": {
    "id": "patient_sora",
    "name": "音羽 響子",
    "age": 22,
    "medical_background": false,
    "has_prior_surgery": false,
    "case_id": "case_abdomen",
    "visuals": {
      "state": "outpatient",
      "portraits": {
        "outpatient/neutral": "assets/characters/portrait_pack_v2/patient_sora/outpatient/neutral.png",
        "ward/neutral": "assets/characters/portrait_pack_v8/patient_sora/ward/neutral.png",
        "ward/smile": "assets/characters/portrait_pack_v8/patient_sora/ward/smile.png",
        "ward/brave": "assets/characters/portrait_pack_v8/patient_sora/ward/brave.png",
        "ward/worried": "assets/characters/portrait_pack_v8/patient_sora/ward/worried.png",
        "ward/afraid": "assets/characters/portrait_pack_v8/patient_sora/ward/afraid.png",
        "ward/crying": "assets/characters/portrait_pack_v8/patient_sora/ward/crying.png",
        "operating_table/awake": "assets/characters/portrait_pack_v7/patient_sora/operating_table/awake.png",
        "operating_table/tense": "assets/characters/portrait_pack_v7/patient_sora/operating_table/tense.png",
        "operating_table/afraid": "assets/characters/portrait_pack_v7/patient_sora/operating_table/afraid.png",
        "operating_table/anesthetized": "assets/characters/portrait_pack_v7/patient_sora/operating_table/anesthetized.png",
        "intraoperative/tense": "assets/characters/intraoperative_portraits_v1/patient_sora/tense.png",
        "intraoperative/pain": "assets/characters/intraoperative_portraits_v1/patient_sora/pain.png",
        "intraoperative/near_collapse": "assets/characters/intraoperative_portraits_v1/patient_sora/near_collapse.png",
        "intraoperative/anesthetized": "assets/characters/intraoperative_portraits_v1/patient_sora/anesthetized.png",
        "splash/general_anesthesia": "assets/events/anesthesia_v1/patient_sora/general.png",
        "examination/shy": "assets/characters/examination_portraits_v1/patient_sora/shy.png",
        "operating_table_lithotomy/awake": "assets/characters/portrait_pack_v7/patient_sora/operating_table_lithotomy/awake.png",
        "operating_table_lithotomy/tense": "assets/characters/portrait_pack_v7/patient_sora/operating_table_lithotomy/tense.png",
        "operating_table_lithotomy/afraid": "assets/characters/portrait_pack_v7/patient_sora/operating_table_lithotomy/afraid.png",
        "operating_table_lithotomy/anesthetized": "assets/characters/portrait_pack_v7/patient_sora/operating_table_lithotomy/anesthetized.png"
      }
    },
    "admission_status": "outpatient",
    "voice_style": "direct",
    "personality": {
      "primary": "anxious_sensitive",
      "secondary": "analytical",
      "stress_response": "asks_for_details"
    },
    "dialogue_profile": "anxious_analytical_detail",
    "traits": {
      "baseline_anxiety": 78,
      "pain_sensitivity": 62,
      "privacy_sensitivity": 54,
      "trust_baseline": 48,
      "control_need": 72,
      "expressiveness": 64,
      "health_literacy": 76,
      "compliance_tendency": 74
    },
    "fear_profile": {
      "pain_fear": 68,
      "procedure_fear": 74,
      "diagnosis_fear": 82,
      "loss_control_fear": 78
    },
    "outpatient_lines": {
      "complaint": "{line}",
      "primary": "{line}",
      "secondary": "还有，{line}",
      "background": "我以前没得过什么大病，也没有药物过敏。"
    }
  },
  "fallback": {
    "case_id": "case_abdomen",
    "surgery_id": "surgery_appendix"
  },
  "encounter": {
    "full_undress": {
      "prompt": "「全部脱掉？连内衣也要吗？只是基础查体，真的需要这样吗？」（在诊室里就这样脱光……她说得像量血压一样普通。）",
      "responses": {
        "abandon_full_undress": "「好……那就先不脱了。谢谢你听我说。」（总算不用在这里全裸，可是检查没做完真的没问题吗……）",
        "authoritative_full_undress": "「既然是检查要求……好，我脱。请、请不要一直看着。」（她说得这么确定，我再拒绝好像就是不配合治疗。）她红着脸逐件脱去衣物，把内衣也放进托盘，在诊察灯下完成了基础查体。",
        "gentle_full_undress": "「如果你会一步一步告诉我……那我可以配合。」（还是很羞耻，但至少她没有催我。先从外套开始……）她按你的提示慢慢脱去全部衣物；护士照常在旁记录，你随后完成基础查体。",
        "threaten_full_undress": "「别这样说……我脱就是了。请不要把我记成拒绝治疗。」（衣服一件件离开身体。原来不同意，也会被当成不配合。）她不再争辩，僵硬地脱到一件不留。你按流程完成基础查体。"
      },
      "visual_pool_id": "full_undress_basic_exam"
    },
    "title": "第一份病历"
  },
  "preop": {
    "stage_prompts": {
      "ward_visit": "「医生，是准备安排手术了吗？」",
      "team": "坂口医生担任主刀，选好与坂口医生配合的三位同事。",
      "preparation": "指派一位未进手术团队的护士；可以让护士完成准备，也可以由坂口医生亲手执行。额外照顾最多选两项。",
      "prepared": "「我准备好了……我们什么时候过去？」",
      "changing": "先换上手术服，再完成刷手准备。",
      "operating_room": "「医生，坂口医生来了……」",
      "team_confirmations": "手术开始前，团队成员依次确认自己的职责。",
      "procedure_select": "请选择本次时间演示使用的术式。当前版本会直接结算耗时与成功结果。",
      "procedure_mismatch": "「不、不是吧，医生？我不是要做那里……！」",
      "ready": "所有人都在自己的位置上。先决定如何让患者度过接下来的过程。",
      "general_induction": "「医生，坂口医生还在旁边吗？」",
      "surgery_start_general": "患者已经进入全身麻醉，监护数据平稳。坂口医生抬眼确认团队已经就位。",
      "surgery_start_epidural": "「我还是醒着的……有点害怕。等一下需要我屏住呼吸吗？」",
      "surgery_start_local": "「局部麻醉真的够吗？我好紧张……开始前请告诉我。」",
      "surgery_start_none": "「等一下，两人还没有麻醉吧？现在就要下刀吗？」",
      "instrument_handoff": "坂口医生的命令落下，器械护士已经准备好第一把器械。",
      "assistant_ready": "器械已经到手。助手女医正等待坂口医生的下一项指令。",
      "incision_ready": "助手维持着稳定的张力。手术刀已经停在预定切口上方。",
      "general_operation": "患者在全身麻醉下没有语言反应。坂口医生与团队完成暴露和关键步骤，监护数据持续显示在屏幕上。",
      "operative_contact": "切口已经建立。患者的反应变得明显，坂口医生需要决定如何回应。",
      "ongoing_interaction": "操作仍在继续。患者正在根据坂口医生的态度调整自己的反应。",
      "closure_interaction": "最紧张的一段已经过去。坂口医生准备如何结束这次互动？",
      "procedure_flow": "团队进入术式特有的关键步骤。",
      "procedure_execute": "关键步骤已经完成，术野确认无误。现在可以结束手术并进入缝合。",
      "surgery_result": "切口已经缝合，手术团队完成器械清点与术后交接。"
    },
    "title": "手术前的一段时间",
    "initial_anxiety": 2,
    "initial_interaction": {
      "fear": 35,
      "pain": 0,
      "dignity": 100,
      "cooperation": 70
    },
    "incision_responses": {
      "incise_general": "刀锋沿预定切口落下。患者在全身麻醉下没有意识反应。",
      "incise_epidural": "「我感觉到被碰到了……不算很痛，可我还是有点怕。」",
      "incise_local": "「嘶……有一点刺痛。请慢一点，我会尽量不动。」",
      "incise_none": "「啊——！停下！好痛……我不行，我真的不行！」"
    }
  },
  "exclusive_cg_pools": {
    "examination": [],
    "surgery": [],
    "ward_preparation": [
      {
        "id": "scalpel_ready_patient_sora",
        "label": "音羽響子 · 手术刀准备下刀",
        "priority": 100,
        "presentation": "fullscreen",
        "action_ids": [
          "request_scalpel"
        ],
        "patient_ids": [
          "patient_sora"
        ],
        "paths": [
          "assets/events/ward_preparation_v1/patient_sora/scalpel_ready.png"
        ],
        "caption": "坂口医生接过器械护士递来的手术刀，刀锋停在预定切口上方。仍然清醒的音羽響子盯着刀刃，眼泪不受控制地滑落。『等、等一下……真的要开始了吗？』"
      }
    ]
  },
  "diagnosis_reactions": [
    {
      "id": "diagnosis_sora_breast",
      "event_type": "first_surgery_diagnosis_shock",
      "site_group": "breast",
      "tags": [
        "fear",
        "light_h",
        "grotesque_imagination"
      ],
      "weight": 1.0,
      "lines": [
        "她先点头，随后像突然想起了什么。",
        "「等一下。」",
        "「……你们从哪里进去？」",
        "「不会从乳头进去吧……」",
        "她明显被自己脑内的画面吓到了。"
      ]
    },
    {
      "id": "diagnosis_sora_abdominal",
      "event_type": "first_surgery_diagnosis_shock",
      "site_group": "abdominal",
      "tags": [
        "embarrassment",
        "body_image",
        "light_h",
        "fear"
      ],
      "weight": 1.0,
      "lines": [
        "她低头看自己的腹部。",
        "「完了……我最近吃太多了。」",
        "她捏了一下小腹。",
        "「有一点小肚子。」",
        "「偏偏现在要给别人开刀看到……好丢人。」"
      ]
    },
    {
      "id": "diagnosis_sora_gynecology",
      "event_type": "first_surgery_diagnosis_shock",
      "site_group": "gynecology_pelvic",
      "tags": [
        "light_h",
        "fear",
        "body_future",
        "embarrassment"
      ],
      "weight": 1.0,
      "lines": [
        "她一直很认真地点头。",
        "「嗯，我明白。」",
        "沉默几秒以后，她小声开口。",
        "「以后那个的时候……不会感觉里面哪里以前被动过吧？」",
        "她立刻把脸捂住。\n「我为什么第一时间想到这个啊……」"
      ]
    },
    {
      "id": "diagnosis_sora_thoracic",
      "event_type": "first_surgery_diagnosis_shock",
      "site_group": "thoracic_cardiac",
      "tags": [
        "fear",
        "body_privacy",
        "grotesque_imagination",
        "soft_erotic"
      ],
      "weight": 1.0,
      "lines": [
        "她下意识按住胸口。",
        "「所以……你们真的会看到我的心脏？」",
        "「它会在你们面前跳吧……」",
        "她脸色很复杂。",
        "「好奇怪。光想象就觉得有点羞耻。」"
      ]
    },
    {
      "id": "diagnosis_sora_generic",
      "event_type": "first_surgery_diagnosis_shock",
      "site_group": "generic",
      "tags": [
        "fear",
        "shock"
      ],
      "weight": 1.0,
      "lines": [
        "「对不起。」",
        "「我知道你刚才已经解释得很清楚了。」",
        "她停了一下。",
        "「但我现在脑子里好像一句都没剩下。」",
        "「只剩『我要被开刀』这件事。」"
      ]
    }
  ]
}
