{
  "schema_version": 1,
  "patient": {
    "id": "patient_doa_kasumi",
    "name": "霞",
    "age": 19,
    "medical_background": false,
    "has_prior_surgery": false,
    "case_id": "case_abdomen",
    "visuals": {
      "state": "outpatient",
      "portraits": {}
    },
    "admission_status": "outpatient",
    "voice_style": "soft",
    "personality": {
      "primary": "shy",
      "secondary": "caring",
      "stress_response": "becomes_quiet"
    },
    "dialogue_profile": "shy_reassurance_quiet",
    "traits": {
      "baseline_anxiety": 57,
      "pain_sensitivity": 69,
      "privacy_sensitivity": 83,
      "trust_baseline": 46,
      "control_need": 86,
      "expressiveness": 38,
      "health_literacy": 34,
      "compliance_tendency": 79
    },
    "fear_profile": {
      "pain_fear": 75,
      "procedure_fear": 73,
      "diagnosis_fear": 55,
      "loss_control_fear": 90
    },
    "reaction_lines": {
      "hospitalization_question": "「需要住院……？我明白了。只是还有些事情要安排……医生，大概需要多久？」",
      "hospitalization_response": "「好，我会留下来接受治疗。一直躲着身体的问题也没有用……这次，我会听从安排。」",
      "procedure_mismatch": "「……请等一下。刚才告诉我的手术名称不是这个。麻烦再核对一次……这件事不能出错。」",
      "explain_plan": "「谢谢您说明。我不怕知道实际要做什么……比起不明白地等待，这样更容易安心。」",
      "brief_plan": "「……就这样吗？对不起，我不是怀疑您……但能再告诉我，接下来会怎样准备吗？」",
      "last_reassure": "「……我会配合。只是身体比想象中更紧绷……医生，开始之前，请再跟我说一声。」",
      "choose_general": "「全身麻醉……那段时间里，我连自己是否安全都无法确认了。……我把这件事托付给您。」",
      "choose_epidural": "「硬膜外麻醉……意识还在，却不能自由活动。……明白了，我会尽量让自己平静下来。」",
      "choose_local": "「局部麻醉吗？我会按指令保持姿势。如果深处还有疼痛……请允许我马上告诉您。」",
      "choose_none": "「完全不麻醉……就要开刀吗？……我经历过战斗，但那和躺着接受切开不是同一回事。」",
      "induction_reassure": "「……嗯。接下来就麻烦您了。等我醒来……请告诉我手术已经结束。」",
      "insist_without_anesthesia": "「医、医生……！我知道已经开始了，可是……真的太痛了！请听我说……先停一下！」",
      "assistant_stabilize_none": "「我会努力不动……可是没有麻醉的话，疼痛一来，我怕身体会自己躲开……请先告诉我下一步。」",
      "assistant_stabilize_local": "「……这样扶着就好。刚才有一阵很深的牵拉感……请别突然移动我的身体。」",
      "assistant_stabilize_epidural": "「腿已经不听使唤了……我知道是麻醉的作用。……只是这样被安置好，心里还是有点慌。」",
      "incise_epidural": "「……已经开始切开了吗？我没有感觉到尖锐的痛……可是里面有压力。……请告诉我现在的进度。」",
      "incise_local": "「嘶……！皮肤那里还好，可刚才深处被拉动了一下……医生，我能先告诉您哪里不舒服吗？」",
      "incise_none": "「啊——！！好痛！等一下……真的切开了……！医生，求您先停一下……我控制不住了！」",
      "contact_pause": "「……停下来了？谢谢……请让我缓一下。我会努力听清楚下一步的指令……」",
      "contact_command": "「……是，明白。我尽量不动。……如果身体发抖，请不要以为我在故意反抗。」",
      "contact_continue": "「……可以继续。我还是很害怕……但这次如果受不了，我会马上告诉您。」",
      "ongoing_narrate": "「……谢谢您告诉我进度。能听到明确的说明，我就不用一直猜接下来会发生什么。」",
      "ongoing_eye_contact": "「……医生。嗯，我看得到您……也听得见。……如果我没有回答，请再叫我一次。」",
      "ongoing_silent": "「……医生？怎么突然这么安静……？是手术出了什么问题吗……请回答我一下。」",
      "closure_reassure": "「快结束了……？……太好了。我还以为自己能一直保持镇定……结果并没有做到。」",
      "closure_coach": "「……慢慢呼吸。好……我听着。再坚持一会儿就可以了吗……？」",
      "closure_silent": "「……嗯。等全部结束，请再告诉我一次……我想亲耳听见那个结果。」"
    },
    "reaction_variants": {
      "ward_enema": [
        "「灌肠也在准备里吗……？……明白。只是需要别人帮忙做这种事，我有点难为情……」",
        "「请告诉我应该侧向哪一边……我会配合。……对不起，虽然答应了，还是忍不住紧张。」",
        "「……这是为了手术前的准备吧。我知道不该擅自躲开……请先让我做好心理准备。」"
      ],
      "ward_enema_unnecessary": [
        "「……如果这次手术并不需要灌肠，可以先核对一下吗？我不是要逃避必要的准备。」",
        "「这一步不是必需的吗……？那请按照真正需要的项目来吧。……谢谢您告诉我。」"
      ],
      "ward_skin_prep": [
        "「备皮……是要剃除手术范围的毛发吗？……我会配合，请先说明具体到哪里。」",
        "「连那里也需要处理……？……明白了。只是……请不要突然掀开遮盖，好吗？」",
        "「……我平时很注意自己的行动，可这种准备没办法自己完成。……拜托您了。」"
      ],
      "ward_skin_prep_unnecessary": [
        "「这里并不是手术要处理的范围吧……？对不起，能先确认是否真的需要备皮吗？」",
        "「如果不必剃除这些毛发……我希望不要多做。……需要的部分我会认真配合。」"
      ],
      "ward_surgical_cap": [
        "「要把头发和耳朵都收进帽子里……？……好，我把发带取下来。」",
        "「……这样就戴好了吧。连头发都看不见，突然有种真的要上手术台的感觉……」"
      ],
      "operative_positioning_awake": [
        "「手放在这里，身体朝这一边……嗯，我记住了。……之后需要调整时，请先告诉我。」",
        "「这种姿势要一直保持吗……？……我会配合。只是被这么多人围着，有点不习惯。」",
        "「我能控制自己的动作……但躺着完全交给别人调整，原来是这么难适应的事。」"
      ],
      "operative_positioning_none": [
        "「……如果没有麻醉，疼得想缩起来时怎么办……？请别把我的反应当成故意乱动。」",
        "「我会记住必须保持这个姿势……可是光想到接下来要切开，身体已经在发抖……」",
        "「……战斗时我能主动闪避。现在必须一动不动……请您在开始前再确认一次。」"
      ],
      "urinary_catheterization_awake": [
        "「还需要导尿……？……我知道是医疗准备，可是……请先告诉我什么时候开始。」",
        "「……尿道口的操作也必须由护士来做吗……？我会配合，只是请给我一点时间。」",
        "「……有点不舒服。对不起，我并不是要动……请提醒我该怎么保持姿势。」"
      ],
      "urinary_catheterization_none": [
        "「完全没有麻醉就要导尿吗……？……请先让我缓一口气，我现在很紧张。」",
        "「呜……那里很敏感……！对不起，我知道这是准备，可我真的很难不缩起来……」"
      ],
      "skin_disinfection_awake": [
        "「……好凉。消毒已经开始了吗……？……我会保持不动。」",
        "「范围比想象中大……。谢谢您先告诉我……接下来就是切口确认了吗？」"
      ],
      "skin_disinfection_none": [
        "「好冷……消毒完以后，就要在没有麻醉的情况下切开了吧……？」",
        "「……这只是消毒，我知道……可想到下一步，手指还是一直发抖……」",
        "「……请不要突然开始。至少，让我听见您说要下刀了……」"
      ],
      "incision_marking_awake": [
        "「这条线就是切口的位置……？……我明白了。正式开始前，请再确认麻醉的效果。」",
        "「……原来会在这里做标记。看见它，比听说明时更紧张一些……」"
      ],
      "incision_marking_none": [
        "「……这里要直接切开吗？……我明明看清楚了位置，却还是不敢想象那一下疼痛。」",
        "「请等一下……标记已经完成，我知道……但没有麻醉就要开始，我还没能镇定下来……」"
      ]
    },
    "outpatient_lines": {
      "complaint": "……医生，我本来想再观察一阵子，可是身体出现了这样的情况：{line}",
      "primary": "最明显的不舒服是：{line} ……我会认真回答，您可以继续问。",
      "secondary": "另外，还有这个状况：{line} ……也请您一起记录。",
      "background": "我叫霞，来自一个习武的家庭。现在大多独自行动，很少在同一个地方停留。身体不舒服时总习惯自己处理……这一次，我想听听医生的判断。"
    }
  },
  "fallback": {
    "case_id": "case_abdomen",
    "surgery_id": "surgery_appendix"
  },
  "encounter": {
    "title": "霞的门诊检查",
    "full_undress": {
      "prompt": "「……需要把衣服全部脱下才能完成检查吗？……我明白了。只是……能先告诉我会检查哪些部位吗？」",
      "responses": {
        "abandon_full_undress": "「这项检查先不做吗……？……谢谢。不过如果是必须确认的部分，请别因为我紧张就省略。」",
        "authoritative_full_undress": "「……明白。我会配合……请先把检查范围说明清楚，可以吗？」",
        "gentle_full_undress": "「谢谢您先告诉我理由……我会照做。……只是这种事，我还不太习惯。」",
        "threaten_full_undress": "「……请别用那种方式催我。我知道自己需要接受检查……但这样说，只会让我更难平静。」"
      },
      "visual_pool_id": ""
    }
  },
  "preop": {
    "title": "霞的术前安排",
    "initial_anxiety": 3,
    "initial_interaction": {
      "fear": 40,
      "pain": 0,
      "dignity": 100,
      "cooperation": 75
    },
    "stage_prompts": {
      "ward_visit": "「医生……今天就要手术了吧。……麻烦您先告诉我一会儿的安排。我会认真配合的。」",
      "graphic_preop_question": "「……我想再确认一下。待会儿进入手术室以后，体位、固定、消毒，到真正开始切开，会按什么顺序进行？……如果我还醒着，能请您事先告诉我吗？」",
      "graphic_preop_dialogue": "霞坐在病床边，安静听着医护将即将进行的准备与手术操作逐项说明。她平时习惯在危险到来前观察退路，可当她听到体位固定、切口与深部操作的细节时，才真正意识到自己一会儿必须躺着接受这一切。她没有打断说明，只是放在膝上的双手渐渐攥紧，直到医护问她是否听懂，才轻轻点头。",
      "team": "你担任霞本次手术的主刀。请确认助手医生、器械护士与巡回护士的岗位分工。",
      "preparation": "请安排霞的病房准备护士，并根据当前病例和术式执行必要的术前准备项目。",
      "prepared": "「……准备都完成了？谢谢您。……接下来，就要去手术室了吧。」",
      "changing": "手术团队按既定流程更衣、刷手并完成无菌准备，随后进入手术室。",
      "operating_room": "「……这里很亮。手臂这样放就可以了吗？……请告诉我什么时候需要保持不动。」",
      "team_confirmations": "手术团队逐项核对霞的身份、当前病例对应的手术计划和成员分工。霞听到自己的姓名与拟行术式后，低声作出确认。",
      "procedure_select": "请根据当前病例已经确认的手术计划核对本次术式，不得因患者身份预设病因或具体手术。",
      "procedure_mismatch": "「……请稍等。刚才确认的不是这项手术……请重新核对病历，确定以后再继续。」",
      "ready": "霞已经完成本次手术需要的术前准备。团队需最终确认麻醉方式、体位和手术开始条件。",
      "general_induction": "「……嗯。我知道了。醒来以后……请告诉我手术已经结束。拜托您了。」",
      "surgery_start_general": "霞已进入全身麻醉状态。手术团队继续监护，并按照当前术式推进，不出现清醒患者的术中对白。",
      "surgery_start_epidural": "「……腿已经动不了。我知道是麻醉起效了……开始的时候，请先告诉我。」",
      "surgery_start_local": "「这里已经麻了吗……？……我会尽量保持不动。如果里面仍然不舒服，我会说的。」",
      "surgery_start_none": "「真的要完全不麻醉地开始……？……对不起，我不是想临阵逃走……只是很害怕。」",
      "instrument_handoff": "主刀提出器械需求，器械护士按当前术式与操作阶段递交相应器械。",
      "assistant_ready": "助手医生核对霞的体位及术野暴露条件，准备按主刀指令维持必要的牵引与辅助。",
      "incision_ready": "团队已核对切口位置与麻醉状态。助手维持术野，器械护士备好手术刀，等待主刀确认开始。",
      "general_operation": "霞处于全身麻醉状态，不产生清醒的术中主观反应。手术团队持续监护，按当前术式操作。",
      "operative_contact": "切口已经建立。若霞保持清醒，她通常先安静听从指导，紧张时会收敛言语；牵拉与疼痛反应依麻醉状态和既有数值规则判定。",
      "ongoing_interaction": "手术仍在进行。若霞保持清醒，她希望有人说明进度；她可能先压抑恐惧，疼痛超过承受限度时则会直接求助。",
      "closure_interaction": "手术进入收尾阶段。若霞清醒，她会等到医护明确告知结束，才渐渐放松；全麻状态下只进行团队叙述。",
      "procedure_flow": "进入当前术式的标准操作流程，依该术式现有阶段与技术选项继续。",
      "procedure_execute": "主要操作已经完成。团队复核术野和必要技术结果，继续进行最终处理与缝合。",
      "surgery_result": "手术结束。团队依照既定流程完成切口处理、器械清点及术后交接。"
    },
    "incision_responses": {
      "incise_epidural": "「……已经开始切开了吗？我没有感觉到尖锐的痛……可是里面有压力。……请告诉我现在的进度。」",
      "incise_local": "「嘶……！皮肤那里还好，可刚才深处被拉动了一下……医生，我能先告诉您哪里不舒服吗？」",
      "incise_none": "「啊——！！好痛！等一下……真的切开了……！医生，求您先停一下……我控制不住了！」"
    }
  },
  "exclusive_cg_pools": {
    "examination": [],
    "ward_preparation": [],
    "surgery": []
  },
  "diagnosis_reactions": []
}
